{
  "schema_version": "1.0.0",
  "specimen_id": "CRY-NODES-001",
  "material_family": "quartz",
  "dimensions": {
    "length_mm": 110.0,
    "diameter_mm": 32.0,
    "facet_count": 6,
    "termination_angle_deg": 51.7
  },
  "mass_g": 232.0,
  "measured_nodes_mm": [27.5, 55.0, 82.5],
  "uncertainty": {
    "length_mm": 0.5,
    "width_mm": 0.5,
    "angle_deg": 1.0
  },
  "supplier": "fixture supplier",
  "operator": "fixture operator",
  "provenance": {
    "entered_by": "fixture operator",
    "method": "calipers + protractor"
  },
  "classification": "MEASURED_INPUT"
}
